<?xml version="1.0" encoding="UTF-8"?>
<classes xmlns:xsi="http://www.w3.org/2001/XMLSchema-instance" xsi:noNamespaceSchemaLocation="D:\iti\projects\c# and XML project\attendance-management-system\xml\classesSchema.xsd">
  <class>
    <classId>Math2</classId>
    <className>Mathematics2</className>
    <teacherId>11144411111215</teacherId>
    <students>
      <studentId>01234532569421</studentId>
    </students>
  </class>
  <class>
    <classId>Math3</classId>
    <className>Mathematics3</className>
    <teacherId>11144411115555</teacherId>
    <students>
      <studentId>01234532569421</studentId>
    </students>
  </class>
</classes>